<!DOCTYPE suite SYSTEM "../tests/ajcTestSuite.dtd"[]>

<!--
	JDK 23 (https://openjdk.org/projects/jdk/23/):
		455:	Primitive Types in Patterns, instanceof, and switch (Preview)
		466:	Class-File API (Second Preview)
		467:	Markdown Documentation Comments
		469:	Vector API (Eighth Incubator)
		473:	Stream Gatherers (Second Preview)
		471:	Deprecate the Memory-Access Methods in sun.misc.Unsafe for Removal
		474:	ZGC: Generational Mode by Default
		476:	Module Import Declarations (Preview)
		477:	Implicitly Declared Classes and Instance Main Methods (Third Preview)
		480:	Structured Concurrency (Third Preview)
		481:	Scoped Values (Third Preview)
		482:	Flexible Constructor Bodies (Second Preview)
-->
<suite>

	<!-- https://openjdk.org/jeps/455 -->
	<ajc-test dir="features1923/java23" vm="23" title="primitive types patterns - switch">
		<compile files="PrimitivePatternsSwitch1.java" options="--enable-preview -23"/>
		<run class="PrimitivePatternsSwitch1" vmargs="--enable-preview">
			<stdout>
			<line text="one"/>
			<line text="two"/>
			<line text="many"/>
			<line text="lots"/>
			</stdout>
		</run>
	</ajc-test>
	
	<ajc-test dir="bugs1923/gh328" vm="17" title="problem with inline accessor generator for around advice">
		<compile files="One.java" options="-17">
		</compile>
	</ajc-test>
	
	<ajc-test dir="bugs1923/gh327" vm="17" title="problem with intertype field declaration code generation - static">
		<compile files="A.aj" options="-17">
		</compile>
	</ajc-test>
	
	<ajc-test dir="bugs1923/gh327" vm="17" title="problem with intertype field declaration code generation - nonstatic">
		<compile files="B.aj" options="-17">
		</compile>
	</ajc-test>

    <ajc-test dir="new/verifyError" pr="36673"
      title="problem with intertype field declaration code generation - private">
        <compile files="Privilege.java" options="-17"/>
        <run class="Privilege"/>
    </ajc-test>

	<ajc-test dir="bugs1923/gh327" vm="17" title="problem with intertype method declaration code generation">
		<compile files="F.aj" options="-17">
		</compile>
	</ajc-test>

	<ajc-test dir="bugs1923/gh326" vm="17" title="classcast on exception handling aspect">
		<compile files="pkg/BusinessDao.java pkg/BusinessService.java pkg/SourceException.java pkg/TargetException.java pkg/BusinessDto.java pkg/HandleSourceException.java pkg/SourceExceptionHandlerAspect.aj" options="-17">
		</compile>
		<run class="pkg.BusinessService">
		<stdout>
		<line text="42"/>
		</stdout>
		</run>
	</ajc-test>

	<ajc-test dir="bugs1923/gh322" vm="17" title="ajc error for particular Pointcut and @Deprecated">
		<!--
		<compile files="TheClass.java TheInterface.java TheAspect.java SomeAnnotation.java" options="-17,-Xlint:ignore">
		</compile>
		<compile files="TheInterface.java TheAspect.java SomeAnnotation.java TheClass.java" options="-17,-Xlint:ignore">
		</compile>
		-->
		<!-- -proc:none is what exposes the problem: annotations are then not stored, so the @Deprecated handling in the compiler is exercised (fixed in 1.9.25) -->
		<compile files="TheAspect.java SomeAnnotation.java TheClass.java TheInterface.java " options="-17,-Xlint:ignore,-proc:none">
		</compile>
		<compile files="TheClass.java TheInterface.java TheAspect.java SomeAnnotation.java" options="-17,-Xlint:ignore,-proc:none">
		</compile>
	</ajc-test>

	<ajc-test dir="bugs1923/gh316" vm="17" title="ajc fails when aspect is annotated with @Deprecated">
		<!-- The abstract aspect has a javadoc @deprecated tag and the subclass has @Deprecated, it is the combination that matters.
		     Fixed in 1.9.23 for the NPE, but until 1.9.25 the @Aspect annotation was silently dropped from the subclass. -->
		<compile files="example/AbstractAccessRightsAspect.aj example/AccessRightsAspect.aj example/AccessRightsHelper.java example/UsesIt.aj example/Main.java" options="-17">
		</compile>
		<run class="example.Main">
			<stdout>
				<line text="deprecated=true"/>
				<line text="aspect=true"/>
			</stdout>
		</run>
	</ajc-test>



</suite>
